,0,1,2,3
115,LVN - HHP (Outpatient),Huntington Hospital,"Pasadena, CA","LVN - HHP (Outpatient)
Department: HHP Pods
Req Number: 14794
Schedule: Full Time
Shift: Days
Hours:
Job Details:
Huntington Health Physicians (HHP) is a partner of Huntington Hospital with 7 medical offices in the greater Pasadena area. For over 20 years, we have been providing high-quality care and patient-centered service to our community in out-patient settings.
We need an LVN to join our La Canada Pediatrics office.  The LVN works with providers and staff in our outpatient offices to  act as an advice nurse to our patients and families.  Pr ovides and manages patient care utilizing critical thinking and the nursing process.  Responsible for performing nursing services requiring technical and manual skills under  the direction of the Registered Nurse or Physician. 
Requirements
Recent/relevant experience working on an Electronic Health Records system. Excellent verbal, written, and interpersonal skill; strong organization skills and a keen attention to detail.  Graduate from an accredited nursing program; current active LVN license issued by the State of California; current BLS certification; minimum 2 years relevant work experience.    

*This position is for Huntington Health Physicians.  We have internal medicine, pediatrics, and specialty offices at multiple locations in the greater Pasadena community.
https://www.huntingtonhealthphysicians.org 
   

Transfer Request for Current Huntington Employees"
116,"LVN Care Manager - Los Angeles, CA",CareNational,"Los Angeles, CA","Case Management LVN - Managed Care
Los Angeles, CA (Eastern Suburb, near Monterey Park)
  **Full-Time, Benefits Available CONTRACT opportunity, expected to last around 3-4 months! **
 
Care Manager Job Summary:
The LVN will provide daily care coordination with concurrent review for patients in the hospital or Skilled Nursing Facilities (SNF), either in-person or telephonically.
Responsible for daily discharge planning, concurrent reviews, retrospective reviews, pre-certification/prior authorization request review, and ensures patients meet appropriate level of care based on Interqual guidelines for evidence-based criteria.
This position will also provide case management to patients who are admitted to the hospital or SNF and those patients who may need to be enrolled in ambulatory case management.
Develops working relationships with hospital case managers, health plan, clinics, hospitalists and governing entities.
Works with hospital discharge planners and assists in the coordination of support services.
Responsible for identifying Children Services cases, handling transfers, and utilization review of the case.
Works as part of an interdisciplinary care team coordinating care and collaborating with hospital and health plan staff.

Care Manager Background: 
Valid, unrestricted state Licensed Vocational Nurse (L.V.N.) license.
Around 3 years of acute care, public health, or home health nursing experience, preferably working with Geriatric patients.
Requires minimum 2 years of case management or utilization management experience at a Managed Care Organization (Health Plan/HMO/MSO/TPA/IPA/etc).
Experience in and willingness to be part of multi-disciplinary team.
Ability to interact within all levels of the organization as well as with external contacts.
Must be able to prioritize, plan, and handle multiple tasks/demands simultaneously.
Bilingual in English and Spanish preferred.
    #Clinical"
117,Licensed Vocational Nurse - 8hr,Childrens Hospital of Los Angeles,"Los Angeles, CA","Give your career the best treatment.
Ready to be part of the first and largest pediatric hospital in Southern California? This is Children's Hospital Los Angeles. A place where you can make a real difference in the lives of our patients and their families. A big responsibility? Absolutely. But if you’re up for the challenge, we’re on the lookout for amazing professionals to join our elite teams – talented individuals who can continue our high level of care.

The Licensed Vocational Nurse will primarily be responsible for providing basic care to an assigned group of patients and for carrying out technical procedures. All patient care is specific to the age and/or developmental needs of the patient. Consistently demonstrates commitment to a patient and family focused model of care.

Qualifications: Completed licensed vocational nurse program. Minimum one year pediatric nursing experience.

License, Registration or Certification Required: Current license as a Licensed Vocational Nurse in the state of California. Current CPR card. IV certificate from the California state board required. Phlebotomy certification required."
118,"Licensed Vocational Nurse - Home Health, 7224, 7921",Torrance Memorial Medical Center,"Torrance, CA","Job Description
Under general supervision, evaluates patients, identifies problems, plans programs, prepares and implements patient education and provides direct patient care to help the individual reach his/her potential. Position is autonomous for clinical provision of care in their area of practice within their scope and follows standards of care.
Qualifications
Current licensure to practice vocational nursing in the State of California
Current BCLS from the American Heart Association
Current CA drivers license
One year experience as an LVN/LPN in an acute care setting
Demonstration of good reading comprehension, accurate spelling, and legible handwriting
Demonstration of effective and diplomatic oral communication"
119,Licensed Vocational Nurse,Phoenix House,"Venice, CA","At Phoenix House, change is something we embrace every day as part of our values to deliver exceptional care. Phoenix House provides individualized, holistic drug and alcohol addiction treatment, with a legacy spanning nearly 50 years. We are passionate about healing individuals, families and communities challenged by substance use disorders and related mental health conditions. Phoenix House supports the mission through a holistic approach that focuses on the distinct mental, physical, and social needs of every person; innovation of best-in-class and evidence-based prevention, treatment, and recovery programs; and, the promotion of greater understanding of addiction. Our devoted staff are committed to treating the whole person—and come from all fields. We operate personalized, strength-based, gender-responsive programs while living the values and being accountable for our commitments. Being introspective and becoming part of the solution is integral to every interaction and person we touch. As ‘One Phoenix House’ we believe in having fun along the way – embracing ‘progress not perfection’ as our journey continues. (Part-Time) Reporting to the Program Director, the LVN is responsible for assessing and monitoring the client’s on-going addiction, recovery, and medical needs. The position collaborates with the interdisciplinary team members to coordinate addiction and recovery treatment with medical treatments. SCHEDULE: + Variable – Daytime, Evening, Overnight, and Weekends REQUIREMENTS: EDUCATION/CREDENTIALS: + Licensed Vocational Nurse (LVN) registered with the CA BBS. EXPERIENCE: + Two (2) years’ experience; preferably in substance abuse treatment and/or with adolescents, preferred. + Maintain current licensure/certification including CPR, First Aid, and Medication Management KNOWLEDGE/SKILLS/ABILITIES: + Maintain professional boundaries with staff and clients. + Provide general nursing care services and administers medications. + Use professional nursing processes, including assessment, planning, implementation, and evaluation, while carrying out nursing responsibilities. + Assess health care needs of clients through a variety of routine interdisciplinary assessments, and develops, implements, and evaluates individualized nursing and health care plans accordingly. + Respond to emergency health care needs of the clients. + Perform health screenings of clients. + Collect and record data specific to the health status of clients. + Collaborate to develop nursing guidelines/protocols for medical and healthcare needs. + Monitor and clinically directs special programs such as infection control and medication management. + Participates in interdisciplinary planning meetings and recommends changes in nursing and healthcare programs and/or in the care of clients. + Must maintain a valid CA Drivers’ License, have proof of automobile insurance and maintain a safe driving record based on Phoenix House policy. Phoenix House conducts as needed, job-related background checks, fingerprints, drug testing, physical exams, medical exams, TB testing, verification of employment history and/or reference checks prior to employment. Phoenix House is an Equal Opportunity Employer providing equality of opportunity to all who are protected against discrimination by law, regulation or executive order, including veterans and individuals with disabilities. EEO is the Law:Applicants and employees are protected under Federal law from discrimination. Click http://www.dol.gov/ofccp/regs/compliance/posters/pdf/eeopost.pdf to learn more. EOE Minorities / Females / Protected Veterans / Disabled"
120,LVN (Assisted Living)- Park Vista Health Center,Oakview,"Fullerton, CA","Park Vista Health Center (Assisted Living) is currently hiring a Part Time LVN.
The LVN is responsible for the overall nursing care/service on his/her shift, including the accurate and timely administration of medications, treatments, documentation and emergency calls, as indicated.
PRINCIPLE DUTIES: 
Assists the RN supervisor and/or supervises and oversees the direct care of the residents being provided by the CNA�s on his/her shift in order to maintain quality resident care.
The LVN will be responsible to assist the RN supervisor with contacting resident�s attending physicians for change of condition, new admission orders, discharge orders and all necessary changes in medication and treatment orders. He/She is responsible for  notifying resident family members/surrogate decision makers of changes in condition, changes in medication and treatment orders, obtaining informed  consents, developing resident care plans, accurate and timely documentation of all physician, resident, family member/surrogate decision  maker communication. Ability to respond quickly, calmly and professionally to medical emergencies. Knowledgeable of state and federal regulations.
Knowledgeably and skillfully performs  Intravenous therapy within the LVN scope of practice, tube feedings, oxygen administration and related procedures, catheterizations, suctioning  and dressing changes. Accurately carries out medication administration and  treatment procedures. Assists with direct resident care, such as bathing, grooming, transferring, re-positioning as needed. Willing to accept additional responsibilities in emergency situations to ensure quality resident care is maintained.
Performs other duties as assigned. 
QUALIFICATIONS: 
Current California LVN License in good standing with the Board of Nursing 
Must have BLS Certification.
Must have at least one-year of experience with providing direct nursing care to the elderly and chronically ill  patients preferably in a skilled nursing facility 
Must have knowledge regarding Title 22 and  OBRA Regulations
About Park Vista Health Center:
  ParkVista is a Health Center located in Fullerton, adjacent to the campus of Morningside of Fullerton, a large resort-style Continuing Care Retirement Community. ParkVista offers 82 Medicare certified Skilled Nursing beds and 54 Assisted Living apartments, including a dedicated and secure memory support wing. ParkVista provides professional staffing 24 hours a day, as well as full-service rehabilitation resources including physical, occupational and speech therapy. Set in a beautiful location, our residents enjoy delicious meals; many planned social, recreational, educational and cultural activities; and compassionate assistance with daily living, all with the goal of the highest level of independence possible. 
  We appreciate your interest in employment opportunities at our community. We are committed to hiring high quality, professional and caring individuals. We value and recognize the importance of supporting, training, and retaining our employees to better serve our residents. We look for employees with a passion for customer service.
  Prior to beginning work at our community, applicants must complete and pass a drug screening, physical exam with tuberculosis (TB) skin test, and criminal clearance through FBI and Department of Justice (over 18 only). The background search includes minor misdemeanors and DUIs.
  ParkVista Health Center offers an excellent benefits package including medical, dental, vision, life insurance, flexible spending accounts, and a Safe Harbour 401(k) plan with match.
 Apply online at http://parkvista.hrmdirect.com"
121,LVN (Assisted Living)- Park Vista Health Center,ParkVista CoreCare V,"Fullerton, CA","Park Vista Health Center (Assisted Living) is currently hiring a Part Time LVN.
The LVN is responsible for the overall nursing care/service on his/her shift, including the accurate and timely administration of medications, treatments, documentation and emergency calls, as indicated.
PRINCIPLE DUTIES: 
Assists the RN supervisor and/or supervises and oversees the direct care of the residents being provided by the CNA’s on his/her shift in order to maintain quality resident care.
The LVN will be responsible to assist the RN supervisor with contacting resident’s attending physicians for change of condition, new admission orders, discharge orders and all necessary changes in medication and treatment orders. He/She is responsible for  notifying resident family members/surrogate decision makers of changes in condition, changes in medication and treatment orders, obtaining informed  consents, developing resident care plans, accurate and timely documentation of all physician, resident, family member/surrogate decision  maker communication. Ability to respond quickly, calmly and professionally to medical emergencies. Knowledgeable of state and federal regulations.
Knowledgeably and skillfully performs  Intravenous therapy within the LVN scope of practice, tube feedings, oxygen administration and related procedures, catheterizations, suctioning  and dressing changes. Accurately carries out medication administration and  treatment procedures. Assists with direct resident care, such as bathing, grooming, transferring, re-positioning as needed. Willing to accept additional responsibilities in emergency situations to ensure quality resident care is maintained.
Performs other duties as assigned. 
QUALIFICATIONS: 
Current California LVN License in good standing with the Board of Nursing 
Must have BLS Certification.
Must have at least one-year of experience with providing direct nursing care to the elderly and chronically ill  patients preferably in a skilled nursing facility 
Must have knowledge regarding Title 22 and  OBRA Regulations
About Park Vista Health Center:
  ParkVista is a Health Center located in Fullerton, adjacent to the campus of Morningside of Fullerton, a large resort-style Continuing Care Retirement Community. ParkVista offers 82 Medicare certified Skilled Nursing beds and 54 Assisted Living apartments, including a dedicated and secure memory support wing. ParkVista provides professional staffing 24 hours a day, as well as full-service rehabilitation resources including physical, occupational and speech therapy. Set in a beautiful location, our residents enjoy delicious meals; many planned social, recreational, educational and cultural activities; and compassionate assistance with daily living, all with the goal of the highest level of independence possible. 
  We appreciate your interest in employment opportunities at our community. We are committed to hiring high quality, professional and caring individuals. We value and recognize the importance of supporting, training, and retaining our employees to better serve our residents. We look for employees with a passion for customer service.
  Prior to beginning work at our community, applicants must complete and pass a drug screening, physical exam with tuberculosis (TB) skin test, and criminal clearance through FBI and Department of Justice (over 18 only). The background search includes minor misdemeanors and DUIs.
  ParkVista Health Center offers an excellent benefits package including medical, dental, vision, life insurance, flexible spending accounts, and a Safe Harbour 401(k) plan with match.
 Apply online at http://parkvista.hrmdirect.com"
122,Medical Assistant (Temporary Staffing Unit),DaVita Medical Group,"El Segundo, CA","Overview: 
Responsible for performing patient-oriented procedures under the direction and supervision of a clinician, RN, or LVN to ensure safe and appropriate patient care; assists the clinician with minor surgical procedures; performs a broad spectrum of clerical and administrative duties related to the delivery of patient care assistance
Essential functions:
Consistently exhibits behavior and communication skills that demonstrate DaVita Medical Group’s commitment to superior customer service, including quality, care, and concern with  internal and external customers
Uses, protects, and discloses DaVita Medical Group patients’ protected health information (PHI) only in accordance with Health Insurance Portability and Accountability Act (HIPAA) standards.
Anticipates the clinician’s needs and carries out orders
Checks for patients' arrival status and escorts patients from waiting area to exam rooms. Escorts patients to ancillary services as needed.
Obtains, records, and reports vital signs and other pertinent patient information to RN, LVN, or clinician.
Performs various procedures such as ear lavage, ECG, spirometry, injections, peak flows, pulse oximetry, breathing treatments, suture removals, wound dressings, vision/hearing tests, urine pregnancy tests, urine dips, blood glucose testing, and blood hemoglobin (hemocue) testing.
Performs phlebotomy and processes lab specimens (i.e., 24 hour urine, wound cultures obtained by clinician, biopsy specimens obtained by clinician, etc.) and maintains lab specimen logs as appropriate.
Assists clinician with procedures (pap smears, laceration repairs, other minor surgical procedures) and may assists with more complex department specific specialty procedures (i.e. vasectomies, cystoscopies, thoracentesis, sigmoidoscopies, bunionectomies, joint aspirations, lance surgery, photo therapy, visual fields, pachymetry testing, etc.).
Performs medication administration within scope of practice and documents administration of medications and procedures. Ensures proper documentation of medication administration and documentation procedures.
Maintains and cleans exam/treatment areas, specimen processing areas, and medical equipment. Transports dirty equipment, performs autoclaving and cold sterilization, and maintains autoclave, cidex, and A-test logs. Cleans and stocks exam rooms, treatment/procedure rooms, specimen processing areas, and nursing stations.
Maintains various logs and tickler files and ensures confirmed EKGs are seen by clinician. Maintains cancer/melanoma patients' follow up appointments.
Instructs patient on lab, radiology, and other procedure/testing preparations. Participates in visit closure with patient and clinician by explaining next steps for lab, x-ray, RFS, DME, etc.
Facilitates the transfer of pertinent patient information between site and referred specialists, hospitals, Urgent Care Centers, and ancillary testing facilities, etc. Forwards all pre-op information to hospital surgeon. Participates in scheduling specialty procedures (biopsies, minor surgeries, etc.).
Tracks specialty procedures/patient volume on a daily basis when indicated.
Verifies with DaVita Medical Group Connect for approved or denied appointments and follows up by scheduling patients. Enters ""No shows"", and performs ""No Show"" follow up procedures. Works bump list.
Assists with the completion of appropriate forms (DMV, disability, etc.).
Updates patient demographic information.
Performs patient record audits.
Answers, directs, and follows up on incoming calls. Calls patients as requested by clinician.
Distributes incoming correspondence (faxes, consult notes, test results, etc.).
Handles prescription refills as appropriate.
Completes Patient Communication form and responds to patient complaints when necessary.
Assists with Pay for Performance (P4P) research, Hierarchical Condition Categories (HCC) research, telephone call procedures, and patient follow up procedures.
Participates in Quality Improvement projects.
Participates in preparing department for internal and external site audits from SCAN, DHS, etc.
Participates regularly in skills competency evaluations. Participates regularly in site staff and department meetings.
Cross-trains into Care Team Member 1 and 2 positions when indicated.
May assist with site marketing activities (i.e. health fairs, senior Olympics, and other events).
Maintains an independent patient schedule under the direct supervision of a clinician.
Functions as the department mentor, trainer and resource by orienting new employees and coordinating staff schedules and department resources.
Identifies and resolves daily department issues and concerns and escalates to supervisor when necessary.
Participates in the development of department policies and procedures.
Education:
Minimum: 1 or 2 years of post-high school education or a degree from a two-year college.
Minimum: Graduate of an accredited Medical Assistant program.
Minimum: Phlebotomy certificate.
Minimum: Basic Life Support for Healthcare providers” (AHA) or “CPR/AED for the Professional Rescuer” (American Red Cross).
Preferred: Certified Medical Assistant (CMA) preferred.
Experience:
Minimum: Up to and including one year of experience.
Preferred: 1 year of previous Medical Assistant work experience.
Preferred: Over 1 year of experience in a specialty field.
Knowledge, Skills, and Abilities:
Ability to demonstrate basic medication administration
Manual dexterity to use/handle equipment and instruments.
Knowledge of infection control standards and utilization of Personal Protection Equipment (PPE).
Ability to perform essential job functions using proper body mechanics.
Basic Life Support for healthcare providers.
Computer literate (i.e., logging on to computer, usage of keyboard and mouse, familiarity with Windows and email applications).
Ability to type 40 wpm.
Excellent verbal and written communication skills with ability to read, write, speak and understand English clearly.
Customer service oriented.
Ability to concurrently perform multiple tasks.
DaVita Medical Group manages and operates medical groups and affiliated physician networks in California, Colorado, Florida, Nevada, New Mexico, Pennsylvania and Washington. A leading independent medical group in America, DaVita Medical Group has over two decades of experience providing coordinated, outcomes-based medical care in a cost-effective manner. As of June 30, 2017, DaVita Medical Group’s teammates, employed clinicians and affiliated clinicians provided care for approximately 1.7 million patients. DaVita Medical Group’s leadership development initiatives and social responsibility efforts have been recognized by Fortune, Modern Healthcare, Newsweek and WorldBlu.
DaVita Medical Group is an equal opportunity/affirmative action employer.  As such, DaVita Medical Group makes hiring decisions solely on the basis of qualifications and experience, and without regard to age, race, color, religion, sex, gender identity, sexual orientation, national origin, disability or protected veteran status. 
We maintain a drug-free workplace and perform pre-employment substance abuse testing and background verification checks.
DaVita Medical Group will consider qualified applicants who have criminal histories in a manner consistent with the law.
WARNING: Job Recruitment Scam Notice
Please note that DaVita Careers has been made aware of a phishing, job recruitment scam in which third parties are fraudulently representing themselves as recruiters of our company.  These scammers are posting fake DaVita job openings and communicating with job candidates in an effort to obtain personal information and money.  Please follow link to learn more about this scam."
