,0,1,2,3
52,Licensed Vocational Nurse/Licensed Practical Nurse,STG International,"Los Angeles, CA","STG International is accepting resumes ofqualified candidates for the LVN/LPN position to work full-time providing medical care to detainees in custody in support of ICE Health Service Corps at the Immigration and Customs Enforcement Medical Facility.
INTRODUCTION:
The ICE Health Services Corps (IHSC) exists within the organizational structure of the United
States Immigration and Customs Enforcement (ICE), Enforcement and Removal Operations
(ERO) under the supervision of the Department of Homeland Security (DHS). The United States
Public Health Service (USPHS) Commissioned Corps Officers, civil service staff and contractors
comprise the healthcare professionals working together to provide quality healthcare services.
IHSC serves as the medical experts for ICE for detainee health care.
MISSION:
IHSC’s mission is to provide medical care to maintain the health of individuals in the custody of
ICE through an integrated health care delivery system, based on nationally recognized correctional, detention and residential health care standards. The Agency is committed to
providing healthcare services to protect the nation’s health, reduce global disease and provide
medical support for the law enforcement mission of the safe apprehension, enforcement and
removal of detained individuals involved in immigration proceedings. IHSC is committed to
ensuring a system of care that is ethical, responsible, and accountable through rigorous
surveillance and monitoring activities.
MAJOR DUTIES & RESPONSIBILITIES:
Provides direct care to patients within discipline Scope of Practice and performs functions in accordance with current accepted practice, licensure, certification, credentialing and or granted privileges.
Provides treatment of persons throughout the life span as appropriate to discipline and facility setting.
May be expected to respond to and or coordinate response to medical emergencies.
Evaluates health care needs of residents and assists RN in the development of nursing care plans to meet those needs.
Assists with gathering resident data during sick call and medical appointments.
Obtains medical information on residents using pre-established questionnaire and appropriately refers abnormal findings or responses or stated medical problems to the RN, midlevel provider or physician.
Maintains safety when dispensing medications and is continually cognizant of the potential hazards of drug hoarding and trafficking among residents.
Provide patient/resident education as appropriate.
May coordinate health care needs of residents with healthcare team and referrals to off-site providers as appropriate for facility.
Assures a safe and clean working environment at all times.
Participates as member of health care team to ensure that needed equipment, supplies andlogs are available, clean, functional and up to date.
Provides radiological services in accordance with scope of practice and state licensure.
These services will be primarily to conduct tuberculosis surveillance i.e. digital single view chest xrays.
Collect laboratory specimens as requested per IHSC policy and procedures.
Administers medications and treatments as ordered/recommended in accordance with scope of practice and state licensure.
Must adhere to practical nursing principals, procedures and techniques for appropriate patient care and take direction from registered nurses and onsite administrative personnel.
Must adhere to medication administration guidelines, understand pharmaceutical agents and their desired effect recognize adverse effects and take appropriate corrective measures.
Must appropriately document patient/resident encounters according to current standards of care using electronic health records.
Performs record keeping functions in accordance with program policies and position.
Maintains functional proficiency and ease of use utilizing electronic health records as required by, and appropriate to, position.
Completes and passes all discipline specific competencies testing, initially and annually.
Completes all initial, annual and ad hoc training as required/assigned.
Maintains patient confidentiality, and confidentiality of medical records, in compliance with the Privacy Act and HIPAA regulations in all work activities.
Adheres to, and maintains awareness of, IHSC Policies, Procedures, Directives, Operational
Memoranda and accreditation standards as prescribed by ICE/IHSC.
Adheres to, and participates in, IHSC’s Safety, Prevention, Infection and Control, Quality Improvement, Patient Education and other programs and collateral duties as appropriate to position.
Attends and participates in general/medical staff meetings.
Other duties as assigned.


Required Skills
ATTRIBUTES AND PROFESSIONAL QUALITIES:
Strong oral and written communication skills.
Excellent interpersonal skills.
Critical thinking skills
Cultural competency.
Integrity and honesty.
Verbal and written proficiency in Spanish (preferred, not required).
Experience in a detention/correctional or residential healthcare setting (preferred, notrequired).
REQUIRED EDUCATION AND EXPERIENCE:
Degree issuing institution and or program must be accredited by an entity recognized by the U.S.Department of Education
Graduate from an approved, accredited Vocational/Practical Nurse program located in aState, the District of Columbia, or a U.S. territory.
Must have a minimum of one year experience in a hospital, medical office or outpatientclinical setting.
REQUIRED LICENSURE/CERTIFICATION:
Maintains current, active and unrestricted LVN/LPN license by the state in which the dutystation is located. Any changes to license must be reported to employer immediately.
This position does not require privileging by IHSC.
Maintains BLS for Healthcare Providers® certification through the American HeartAssociation.
REQUIRED KNOWLEDGE, SKILLS, AND ABILITIES:
Ability and proficiency to properly use equipment, materials and supplies in simplediagnostic and treatment procedures.
Ability to work in a multi-cultural and multi-lingual environment.
Ability to utilize telephonic interpreter/translation services to complete assigned duties if notfluent in a language the patient understands.
Ability to adapt to sudden changes in schedules and flexibility in work requirements.
Ability to communicate proficiently in English (verbal and written) in order to developpositive rapport with patients, co-workers and other stakeholders.
Ability to establish and maintain positive working relationships in a multidisciplinaryenvironment.
Ability to navigate in an electronic work environment including electronic health records,web based training and communications.
Knowledge of, and moderate proficiency in, common Microsoft Office programs,specifically Microsoft Word, Excel, Outlook and SharePoint.
Knowledge of regulations (HIPAA/Privacy Act) regarding the confidentiality of patientmedical records and information as well as Personally Identifiable Information (PII).
DUTY HOURS/ON-CALL REQUIREMENTS:
IHSC operates 24/7/365; this position is required to respond during an emergency activation.
This full time position requires availability to work day, evening and night shifts.Availability during weekends and holidays is also required.
On-call availability is not required for this position.
SECURITY REQUIREMENTS:
The Department of Homeland Security’s Personnel Security Unit (PSU) must render aPreliminary Favorable Fitness Determination to be considered a qualified candidate.
A Complete Favorable Fitness Determination must be rendered by PSU upon completion ofinitial and subsequent background investigations to meet the requirements of this position.
PHYSICAL DEMANDS:
Required to walk unaided at a normal pace for up to 10 minutes and maintain balance.
Required to respond to any medical emergency within 4 minutes, where a fast walk or jogmay be necessary to provide assistance.
Required to perform CPR/emergency care standing or kneeling.
Must have the ability to assist sick, injured or aging detainees or staff exiting the buildingduring an emergency (may require lifting, dragging, wheeling or carrying someone who weighssignificantly more than self).
Must be able to see, hear and smell with or without the use of aides if necessary(exceptions on a case by case basis).
Must easily alternate between kneeling and standing.
Must be able to lift, push, or carry 30 pounds.
Must perform the duties in a stressful and often austere environment without physicallimitations.
Must be capable of standing on hard services (cement floors) for long periods of time.
SUPERVISORY CONTROLS:
This is a contract position and supervisory controls will be set forth by the Contractor. Technical
oversight will be provided by the Government Technical Monitor (GTM).
STG International, Inc (STGi) is a workforce solutions company providing comprehensive healthcare delivery, Head Start and management consulting services and human capital solutions help our clients. Our services and solutions help our clients sustain and enhance their operations to better accomplish their mission.

STGi offers acompetitive benefits package which includes Medical, Dental, Vision, 401k with company match and a generous PTO policy.
EOE/Minorities/Females/Vet/Disability


Required Experience"
53,Licensed Vocational Nurse - LVN,VALiNTRY Services,"Los Angeles, CA","Skilled Nursing Licensed Vocational Nurse – LVN Job Description
VALiNTRYhealth is seeking a Licensed Vocational Nurse, LVN, needed to work a contract in a Skilled Nursing or Long Term Care facility.
Under supervision of a physician and/or Registered Nurse, the LVN will monitor and provide quality care for the physical and emotional needs of residents within the facility in compliance with nursing standards, federal, state and local government regulations and facility clinical standards of care.

Essential Duties & Responsibilities
• Check residents early in the shift, make periodic assessments, report changes to appropriate personnel, make interventions and document in the medical record; continually assess resident care needs and apply findings to development of the Minimum Data Set, Resident Assessment protocols and interdisciplinary care plans for each resident.
• Participate in coordination and delivery of services with the physician, Registered Nurse and clinical management team; provide appropriate preventative, rehabilitative, and palliative nursing procedures according to the Plan of Care to achieve optimal resident health and quality of life; supervise and direct the care provided by CNAs.
• Implement Plan of Care to include checking resident’s vital signs (blood pressure, temperature, weight, etc.) and recording data in their health records; preparing, administering, and recording medications per physician orders and facility protocols; documenting therapeutic effects of medicines and observing residents for reactions to medications or treatments; administering vaccinations and other injections; providing wound care and dressing; assessing progress of healing; collecting samples and monitoring catheters, etc.
• Provide assistance and training to residents with ADLs which includes medication management, dietary management, personal hygiene and other skills necessary for independent living when applicable; ensure their safety and comfort needs are met.
• Record observations completely, accurately, legibly and concisely; obtain pertinent information from residents and family members as part of ongoing data collection (i.e., discharge needs, ADL status, progress of resident problems, etc.); provide accurate and timely medical documentation consistent with Plan of Care to include writing OASIS assessments as appropriate.
• Prepare clinical and progress notes, submitting all required paperwork daily.
• Report any change in resident’s condition to include hospitalizations, discharges and physician appointments and/or changes in family status to the physician, RN or Patient Care Coordinator immediately; participate in adaptation of established Plan of Care based on day to day changes in resident needs.
• Oversee and implement the self-administered medication management program for residents; administer medication and/or treatment to residents in accordance with RN and physician orders.
• Conform to pharmacy policies to include: maintenance of accurate narcotic book documentation and account, drug security, and syringe count; follow other established pharmacy policies and procedures.
• Coordinate with other service providers like social workers and physicians to ensure the resident receives the necessary medical services.
• Communicate and interact with residents, families and others in a caring, empathetic, courteous and respectful manner; assess and provide residents and family caregivers with education and information pertinent to the diagnosis and Plan of Care; identify learning needs of residents and family caregivers.
• Educate residents on healthy lifestyle habits; encourage residents to stop unhealthy habits; assist residents in learning self-care activities including administering their own medication when possible.
• Ability to initiate emergency protocols in response to resident situations.
• Maintain competence level, professional and technical knowledge by participating in educational workshops and in-service programs, reviewing professional publications, etc.
• Attend staff meetings and in-services as required.

Qualifications & Skill Requirements
• Minimum 1 year of nursing experience, preferably in a skilled nursing facility, long term care facility or assisted living facility.
• Ability to interpret a variety of instructions furnished in written, oral, diagram or schedule form.
• Ability to provide culturally competent care with a strong focus on resident service, follow physician orders, and properly document medical information.
• Excellent observation, interpersonal, verbal and written communication skills; effective clinical problem-solving skills; compassionate, patient, and possess an ability to motivate residents.
• Familiar with computers and handheld devices; experience with electronic records a plus.
• Must adhere to HIPAA guidelines and maintain confidentiality regarding resident and facility proprietary information.
• Be in good physical and emotional condition with an ability to properly care for residents.
• Ability to pass an extensive background check including drug testing.
• Ability to accept assignments immediately!
• Must be able and willing to drive/use own vehicle.

Education/Licensure
• Graduate of an accredited vocational nursing program.
• Current and unrestricted license as a Licensed Vocational Nurse in state of practice.
• Current Basic Life Support (BLS) certification (with AED); current CPR card – hands on required.
• Valid driver’s license and automobile liability insurance.

VALiNTRYhealth Unique Characteristics:
VALiNTRYhealth is a servant-leadership managed, healthcare organization, with collective experience placing over 10,000 clinical professionals in more than 40 states. We manage our business with a servant-leadership philosophy by ensuring that everything we do in our organization first supports and enriches our patients, clinicians and clients; which ultimately enhances the lives of every individual we serve and work with every day.
• VALiNTRYhealth is a Values-based company; we live by our values – Trust & Integrity, People Service, Teamwork, Innovation, Accountability and Transparency.
• VALiNTRYhealth has a Single Point of Contact for you - you will not go from person to person.
• VALiNTRYhealth is a National company.
• VALiNTRYhealth has 100% online easy, hiring process – less than 60-minute completion time.
• VALiNTRYhealth provides comprehensive benefits.
• VALiNTRYhealth has a Weekly Pay Cycle – Direct Deposit.
• VALiNTRYhealth offers Travel Housing Stipends / Meal Stipends.

VALiNTRYhealth Contact:
Ron Murphy
(972) 370-3040
rmurphy@VALiNTRYhealth.com"
54,Licensed Vocational Nurse - LVN - Mission Care Center,Ensign Services,"Rosemead, CA","Licensed Vocational Nurse (LVN)
Shift: Day, NOC (11pm-7am)
Licensure: California LVN License
Will you pledge to live CAPLICO?
Mission Care Center's commitment to excellence extends beyond delivering world class health care. Our company mission is to dignify and transform post-acute care. Our facilitys success is dependent upon our highly motivated clinical professionals working to improve business operations. Our leadership team is driven to provide exceptional service by cultivating a workforce that is dedicated to upholding our companys mission of delivering care with compassion and integrity. We value innovation and creativity in our buildings and love a healthy debate that challenges us to learn and grow.
Are you ready to discover the world of limitless possibilities that comes with being a member of our culture? Are you a LVN who is eager to make a difference? Explore more about this opportunity and how you can help us write a new chapter in our story of providing exceptional care and making a positive impact in the lives of everyone we serve.
Living CAPLICO
CAPLICO
Customer Second: When we take care of our team first, it reflects positively on our customer care.
Accountability: We strive for quality of life and reach for high standards as a team.
Passion For Learning: We want to be at the forefront of change; there is always something we can learn.
Love One Another: Treat others the way you want to be treated. Its simple, yet effective.
Intelligent Risk Taking: If something makes sense, were willing to give it a try.
Celebration: We celebrate life every day of the year with our teammates and residents.
Ownership: When everyone on the team is encouraged to take ownership of the care that they give, it positively improves their attitude, which affects everyone around them, from teammates to residents.
We would love to meet you and hear your pledge to live CAPLICO with us.
In addition to hiring Licensed Vocational Nurses (LVN) who exhibit the above qualities that help us create a world class culture, we offer competitive wages, mentorship and training for new graduates, tuition reimbursement, dependent care and public transportation FSAs, cell phone and movie ticket discounts, 401(k) with matching contributions, career advancement opportunities, and medical, dental, and health insurance. Take a look at these benefits (and more!) at www.ensignbenefits.com
Apply Today!
Mission Care Center
4800 Delta Ave.
Rosemead, CA 91770
www.missioncareandrehab.com
Unable to apply at the moment, or are you interested in hearing more about future opportunities with us? Join our talent network at https://ensignservices.jobs.net/join
The employer for this position is stated in the job posting. Ensign Services, Inc. provides recruiting services for operations in the skilled nursing, assisted living, home health and hospice industries.
Back to Jobs

Ensign Services provides recruiting and placement support services to operations in the health care industry. These employers all offer a work environment where local leaders and teams are empowered to achieve superior clinical outcomes, high patient and family satisfaction, operating efficiencies, and financial performance. We engage in a collective quest to develop and support employees so they can deliver dignified, quality health care experiences to patients in the communities they serve.
It is the policy of the Company to be an equal opportunity employer. The Company is committed to ensuring that all conditions and privileges of employment, including recruitment, hiring, evaluation, transfer, promotion, discipline, determination of compensation and/or benefits, and termination of employment, for all job classifications, are based on qualifications and work record. No employment decision is made, nor does the company discriminate, on the basis of race, color, religion, creed, sex/pregnancy, sexual orientation, gender identity, gender expression, age, national origin, ancestry, citizenship, veteran status, or disability.


Posted 28 Days Ago

Full time

JR15395"
55,Licensed Vocational Nurse (LVN) - San Francisco,CVHCare Home Health,"Burbank, CA","CVHCare, a leader in Home Health Clinical services, headquartered in beautiful San Ramon CA, is currently seeking a License Vocational Nurse (LVN) to join our Home Health Care Agency located in Burbank, CA. This is a great opportunity to join an established leader in the California home health industry, with the freedom to put your skills and imagination to work. We are Compassionate Visionary Health Care, where passion and team spirit are nurtured and rewarded.
About the position:
The Licensed Vocational Nurse is responsible for providing direct patient care under the supervision of a registered nurse.  Responsibilities include following the plan of care, providing treatments, and working collaboratively with the members of the team to help meet positive patient care outcomes. A licensed vocational nurse shall perform duties consistent with the Vocational Nursing Practice Act.  A licensed vocational nurse shall meet qualifications established by the home health agency for the services provided and any additional qualifications required by home health agency licensure regulations. 
Positions Available: 1
Schedule: Full Time, Part Time, Per Diem positions available.
* Non-traditional schedules are available, i.e., Thursday-Monday
Locations: AREA 40 covers the following cities: East San Fernando Valley, North Hollywood, Sherman Oaks, Studio City, Sun Valley, Toluca Lake, Valley Glen, Valley Village, Van Nuys, and Universal City. 
Minimum Required Qualifications:
•    Minimum one year of LVN experience
•    Must possess a CA License with IV/Blood Withdrawal Certification 
•    Reliable Transportation and auto insurance
•    CPR Certification
Desired:
Some advanced college course work or AA degree
Advanced computer system knowledge
Bilingual (English/Spanish, English/Tagalog, English/Armenian) a plus
Who We Are: CVHCare is you!
Our outstanding clinicians and staff make CVHCare an outstanding company it is today.  Our ardent commitment to delivering excellence in patient care is fully ingrained in our company culture, and this starts with our employees. With exceptional skills, passionate dedication, and outstanding values, we've become a thriving home health provider throughout the state of California. You will find that our employees enjoy working for CVHCare, rate our company and leadership highly, and value our commitment to delivering the highest quality of health care and service to our patients.
CVHCare is Compassionate, Visionary Health Care. We believe in sharing skills, knowledge and resources to develop and support the growth of our teams. 
To Apply: Apply at www.CVHCare.com/Jobs
More Information: Visit our website at www.CVHCare.com
CVHCare is committed to the principle of equal employment opportunity for all employees and to providing employees with a work environment free of discrimination and harassment. All employment decisions at CVHCare are based on business needs, job requirements, individual qualifications, and merit….without regard to race, color, religion or belief, national, social or ethnic origin, sex (including pregnancy), age, physical, mental or sensory disability, HIV Status, sexual orientation, gender identity and/or expression, marital, civil union or domestic partnership status, past or present military service, family medical history or genetic information, family or parental status, or any other status protected by the laws or regulations in the locations where we operate. CVHCare will not tolerate discrimination or harassment based on any of these characteristics.
SEO by position: Clinical, Clinician, Field Clinician, Home Health, Home Health Care, Health Care, Healthcare, License, Licensed, Certified, Flexible Schedule, Flexible, Patient, Patient Care, BLS, CPR, Nurse, LVN, Licensed Vocational Nurse"
